"","id","id_review","date","reviewer_id","reviewer_name","comments","name","host_id","host_name","neighbourhood_group","neighbourhood","Lat","Lon","room_type","price","minimum_nights","number_of_reviews","last_review","reviews_per_month","calculated_host_listings_count","availability_365","district","word_count","sd","ave_sentiment","doc_id","ADJ","ADP","ADV","AUX","CCONJ","DET","INTJ","NOUN","NUM","PART","PRON","PROPN","PUNCT","SCONJ","SYM","VERB","X","crime"
"262",7310887,74786851,"5/16/2016",41471338,"Claire","Jacklyn and Joel were very welcoming with instructions emailed and texted to us so that there was no confusion. We were welcomed on arrival by Joel who told us where he would be if we needed anything extra and then in the apartment there was a lovely bottle of wine; very much appreciated after a long day of travelling. The apartment itself was exactly as described and definitely lived up to our expectations; very roomy even with 4 adults. There was extra everything, towels, shampoo, and a washer/dryer for those that prefer to travel light. Travel was easy as there was a T stop a leisurely 10 minute walk away; it runs from 6am to 12.30 which is great if you fancy a night out in Boston.","Spacious and Sunny Brookline Apartment",38302832,"Jacklyn",NA,"Brighton",42.34554,-71.13819,"Entire home/apt",285,3,172,"11/11/2019",2.54,1,0,"D14",125,0.153660742194014,0.364732947690952,"doc262",7,15,13,7,5,9,0,22,4,1,18,5,12,6,0,17,0,5828
"263",19117781,364832332,"12/31/2018",193113332,"Jess","Absolutely wonderful. You won’t go wrong by choosing Bill and Corey’s place. They go to the absolute extreme to make your stay the best. They are a quick walk to/from the train station (Redline) so getting to Boston and other areas is painless. They give great tips and advice and are in constant communication you your whole stay. I would definitely recommend staying with them, truly value for money. 

They also have a dog named Max who is the biggest most friendly bundle of energy.","1880's BostonTownhouse With PrivateBath/RedLine",31035862,"Roger Michael ""Corey""",NA,"Dorchester",42.29367,-71.06209,"Private room",47,1,377,"12/31/2020",8.41,2,193,"C11",88,0.359517802434817,0.34395209004577,"doc263",12,8,6,6,4,6,0,15,0,3,11,5,11,1,0,11,0,12501
"264",13908031,145540085,"4/18/2017",111199268,"Kristi","Awesome place!! Great communication, amazing location, super friendly hosts.  Will definitely stay here again next time I'm in town.","Modern Room, Private Bath near airport & city",5997103,"Andrea And Tivan",NA,"East Boston",42.36914,-71.03512,"Private room",158,1,142,"2/15/2020",2.53,2,0,"A7",19,0.473274155921106,0.483371175207598,"doc264",4,2,4,2,0,0,0,6,0,0,1,0,5,0,0,1,0,3627
"265",43777109,666785910,"9/21/2020",130795313,"William","Christy was one of the best hosts I’ve ever had. Not only was the space perfect for my solo getaway, she was very helpful in making my Massachusetts experience what it was; and it was amazing. I would be surprised if I do not book with her my next time around.","The Cellar at Adams Village",218118364,"Fabs And Christy",NA,"Dorchester",42.28361,-71.05519,"Private room",69,2,5,"9/25/2020",0.67,3,0,"C11",52,0.310041797344995,0.0710147559297585,"doc265",7,3,5,9,1,2,0,5,1,1,11,1,5,3,0,3,0,12501
"266",21683291,211828227,"11/14/2017",155862880,"Stephan","Richmond is such a friendly and kind-hearted person! He was more than willing to help and I had such a good stay at his place. His cheeky dog is amazing, as well! I can totally recommend this airbnb. Nice place, nice owner/pet! 5/5!","Richmond's Cozy Colonial near Lower Mills",46315640,"Richmond",NA,"Mattapan",42.27579,-71.08882,"Private room",55,91,28,"6/7/2019",0.7,2,0,"B3",44,0.216932633204089,0.420709401096994,"doc266",9,2,3,4,2,5,0,9,2,1,5,1,10,0,1,3,0,11007
"267",25328440,321580362,"9/10/2018",32969111,"Miranda","Such a beautiful space and super close to the airport!","Private parking(sedan size), Clean, Comfy room@2",183805757,"Claire",NA,"East Boston",42.3701,-71.03831,"Private room",52,1,174,"1/31/2021",5.22,3,38,"A7",10,NA,0.474341649025257,"doc267",2,1,1,0,1,3,0,2,0,0,0,0,1,0,0,0,0,3627
"268",29390698,340623905,"10/24/2018",26035817,"Johanna","This was the perfect spot to stay before we left town on an early flight!","Uniquely Boston PVT Entry/BATH QN Bed  Sparkling",52881930,"Bill And Maureen",NA,"South Boston",42.33451,-71.02733,"Entire home/apt",116,2,169,"11/1/2020",5.95,3,166,"C6",15,NA,0.193649167310371,"doc268",2,1,0,1,0,2,0,3,0,1,2,0,1,1,0,2,0,6984
"269",45349044,727710451,"1/30/2021",43196280,"Marco","I love it.","FOUND Boston Common - Queen Room",365985792,"FOUND Hotel",NA,"Downtown",42.34948,-71.06605,"Private room",96,1,145,"2/15/2021",26.85,5,320,"A1",3,NA,0.433012701892219,"doc269",0,0,0,0,0,0,0,0,0,0,2,0,1,0,0,1,0,9706
"270",18159981,164790565,"6/29/2017",135749089,"Jan","Perfect location for college tours. Close to the red line subway and nice quiet neighborhood. The place was really nice and clean and Jeffery was the perfect host.","Sunny Boston Apartment",30732884,"Jeffery",NA,"Dorchester",42.29045,-71.06734,"Entire home/apt",195,91,73,"7/10/2019",1.58,3,365,"C11",28,0.318900178872326,0.468210438491814,"doc270",7,2,1,2,3,3,0,8,0,0,0,1,3,0,0,1,0,12501
"271",30349609,613274002,"3/1/2020",151017387,"Adrian","Such a lovely place, and if you're looking for a romantic getaway this is it. Being able to see a wonderful sunrise every morning is truly a great gift, would love to come back again","Romantic Gate away on  a roof with parking",7427795,"Ella",NA,"East Boston",42.37867,-71.03628,"Entire home/apt",80,29,108,"2/5/2021",3.99,6,21,"A7",35,0.559189405088107,0.718155232489423,"doc271",5,1,3,5,1,6,0,5,0,2,3,0,3,1,0,4,0,3627
"272",17744380,439733375,"4/19/2019",75079874,"Matt","Clean secure place. Two bathrooms is nice. The apartment is only a few minute walk to the bus station and about a 10 minute walk to the train station.","Refined Oasis | near South End",42431392,"Frank",NA,"Roxbury",42.32884,-71.08731,"Entire home/apt",243,10,95,"12/8/2019",1.99,7,358,"B2",28,0.366474816875401,0.343042931161667,"doc272",4,3,1,2,1,5,0,11,2,0,0,0,3,0,0,0,0,14525
"273",20634420,335985252,"10/13/2018",220099139,"Nicole","Great first time experience using Airbnb.","Friendly family single room",27871799,"Althea",NA,"Mattapan",42.27611,-71.07857,"Private room",40,1,39,"3/1/2020",0.92,6,0,"B3",6,NA,0.204124145231932,"doc273",2,0,0,0,0,0,0,2,0,0,0,1,1,0,0,1,0,11007
"274",13546414,103823764,"9/24/2016",85375184,"Alice","It was very comfortable and clean !","Walk To Beach or City 2 - Spacious Room",30342817,"Piter & Stacy",NA,"Dorchester",42.31778,-71.05794,"Private room",51,29,270,"11/4/2020",4.78,4,349,"C11",6,NA,0.918558653543692,"doc274",2,0,1,1,1,0,0,0,0,0,1,0,1,0,0,0,0,12501
"275",5769127,426613906,"3/21/2019",224533523,"Robine","An extremely comfortable and homely space, compact but very well thought out. Maverick was very quick to respond to any queries. Also the studio is perfectly situated as a base, close to many sights and landmarks... loved it.","Stylish Downtown Studio in the SouthEnd, C.Ave# 3",22348222,"Maverick",NA,"South End",42.34447,-71.07644,"Entire home/apt",75,1,192,"1/29/2021",2.77,55,319,"D4",38,0.237901997548254,0.430906776080294,"doc275",6,4,6,2,3,4,0,6,0,1,1,1,6,0,0,4,0,11261
"276",1327725,273554565,"6/6/2018",32923074,"Xavier","Staying with Mikhail was great. The apartment was exactly what the pictures showed. It was very spacious, with a nice kitchen and living room. I stayed there with my parents and we absolutely loved it.","Modern 2 BR in Brighton with Parking",7205617,"Mikhail",NA,"Brighton",42.346,-71.1399,"Entire home/apt",98,3,273,"12/7/2020",2.95,1,41,"D14",35,0.174697762729079,0.239287624919665,"doc276",3,3,4,3,2,3,0,6,0,0,6,1,5,0,0,4,0,5828
"277",1821633,46298208,"9/9/2015",4683468,"Nicki","Bruce and Barry were excellent hosts. The house was full of character and our room was perfect for our needs with an extremely comfortable bed. The house was near the subway so easy to get into Boston which was why we were there. We would certainly like to stay again should we return to the area and would highly recommend.","Queen Size Four Poster Bed",7799789,"Bruce",NA,"Dorchester",42.30958,-71.04792,"Private room",100,29,211,"3/7/2020",2.37,3,365,"C11",60,0.112141783415744,0.352977546183026,"doc277",5,6,7,7,3,5,0,8,0,2,6,3,4,0,0,8,0,12501
"278",18789766,200761301,"10/6/2017",67991452,"Michael","Exactly as described.","2Twin Beds close to MBTA, short distance to Fenway",101057334,"Gregory",NA,"Roxbury",42.32985,-71.09484,"Private room",52,1,139,"10/27/2020",3.05,4,180,"B2",3,NA,0,"doc278",0,0,1,0,0,0,0,0,0,0,0,0,1,1,0,1,0,14525
"279",13378936,419168643,"3/3/2019",15673755,"Rafaela","My boyfriend and I stayed in the apartment for more than a month in winter. The place was charming, cozy and had everything we needed: clean space, warm decoration, small but equipped kitchen and very attentive hosts. Location was also great, South end is one of the most charming neighborhoods in Boston and has plenty of nice cafes and restaurants around. Interactions with the hosts couldn’t be better, they’d reply very quickly to all our messages and made sure our stay was pleasant. I really recommend the place and I’d definitely stay there again.","Montgomery Place - One Bedroom",75997654,"Kathe",NA,"South End",42.34347,-71.07368,"Entire home/apt",66,29,130,"6/30/2019",2.29,3,132,"D4",97,0.465358315253665,0.619234359974405,"doc279",14,9,11,6,8,7,0,20,1,1,9,1,11,0,0,10,0,11261
"280",19581567,207974853,"10/30/2017",80098530,"Cherie","Wow!  This apartment is probably the nicest Airbnb I have stayed in so far.  It was perfect for a couple and one other guest, as we each had our own room.  The apartment is nice and modern with all of the amenities you will need, and the rooftop deck is incredible.  I wish we would have had more time to enjoy that space, the views are pretty epic!  The neighborhood is also gorgeous with so many things to do within walking distance!  You can't go wrong booking this space, it was fantastic!  Thank you for hosting us, Tom!","Freedom Trail Condo",93353522,"Thomas",NA,"Charlestown",42.3745,-71.06103,"Entire home/apt",150,2,106,"1/18/2021",2.39,1,77,"A15",98,0.35567284049612,0.187618979957391,"doc280",13,6,6,12,3,12,1,18,1,3,11,1,13,2,0,10,0,1913
"281",22327141,413476616,"2/17/2019",61849317,"Akin","Would definitely recommend.","<U+2605> Spacious, Modern & Comfy<U+2605>Professionally Cleaned!",69587,"Boris & Susan",NA,"East Boston",42.37984,-71.03149,"Private room",43,1,342,"2/15/2021",8.93,8,175,"A7",3,NA,0.519615242270663,"doc281",0,0,1,1,0,0,0,0,0,0,0,0,1,0,0,1,0,3627
"282",24783227,496537608,"7/27/2019",16338094,"Catherine","Logement conforme à l'annonce, pas très grand mais bien conçu. Bien relié à la ville par le métro. Séjour agréable","Sunny ocean-view suite nr subway w/kitchen, bathr.",9898255,"Jessica",NA,"Dorchester",42.31476,-71.06226,"Entire home/apt",120,29,77,"11/17/2019",2.27,5,365,"C11",23,0.0435194139889245,0.0368029411083254,"doc282",4,0,0,0,0,0,0,15,0,0,1,0,3,0,0,0,0,12501
"283",23306611,453393795,"5/15/2019",184113824,"Jay","Beautiful apartment. Not the best area of town.","Spacious 2BR | Full Kitchen | WiFi | China town",30283594,"Global Luxury Suites",NA,"Downtown",42.35309,-71.06061,"Entire home/apt",144,91,26,"2/14/2021",0.84,35,343,"A1",8,0.519337567297406,0.16310297032899,"doc283",2,1,0,0,0,1,0,3,0,1,0,0,2,0,0,0,0,9706
"284",8904656,429325979,"3/27/2019",179464804,"Emmett","Amazing place. Very quiet area and the room is decorated beautiful. One of the best Airbnb experiences that I've had. I highly recommend!","Fireplace Haven",46575567,"Sandy",NA,"Mattapan",42.27204,-71.07757,"Private room",75,29,38,"11/4/2019",0.89,2,359,"B3",23,0.146624640191865,0.359958824882651,"doc284",4,1,2,2,1,2,0,5,1,0,3,0,4,0,0,3,0,11007
"285",9382898,440983327,"4/21/2019",90603764,"Nadia","Tolle location:)sehr sauber, gute öffentliche Transportmittel, gute Verbindung zur Transitline, schnelle und entgegenkommende Antworten von Andrew, alles top:)","Private Bed and Bathroom,parking, close to airport",48677395,"Andrew",NA,"East Boston",42.37914,-71.03956,"Private room",70,91,268,"11/29/2019",4.36,1,364,"A7",19,NA,0.229415733870562,"doc285",3,2,1,1,0,1,0,5,2,0,0,2,6,0,1,2,0,3627
"286",447826,8406273,"10/29/2013",1291987,"Alan","Hilary is a very kind and helpful person. She gave us many suggestions about the surroundings. The area (Jamaica Plain) is quite and very nice with beautiful houses. It isn't so far from the city center (just 8 subway stops) and the subway-station is at short distance.
A friendly place, a nice house and the room even if little is comfortable.
Thanks again to Hilary.
 Bye by Antonio and Alan.","Sweet Little House in JP, Boston",2053557,"Hilary",NA,"Jamaica Plain",42.31658,-71.11012,"Private room",71,7,313,"3/1/2020",2.97,1,269,"E13",70,0.395531873196609,0.390215317832994,"doc286",10,6,8,5,5,8,0,15,1,1,3,7,13,1,0,2,0,5214
"287",19581567,488264064,"7/14/2019",255662144,"Amy","The condo is very nice.  We enjoyed our stay.  The location is perfect and we loved being in Charlestown.","Freedom Trail Condo",93353522,"Thomas",NA,"Charlestown",42.3745,-71.06103,"Entire home/apt",150,2,106,"1/18/2021",2.39,1,77,"A15",19,0.0584878976014754,0.432592314490337,"doc287",2,1,1,3,1,2,0,3,0,0,3,1,3,0,0,2,0,1913
"288",22099733,620936501,"3/26/2020",271310602,"Najah","This place was very clean and felt like home. Highly recommend.","<U+2605> Chic, Clean & Large <U+2605> Professionally Cleaned! <U+2605>",69587,"Boris & Susan",NA,"East Boston",42.3788,-71.03192,"Private room",43,1,383,"2/13/2021",10.05,8,170,"A7",11,0.0803300858899107,0.693198051533946,"doc288",1,1,2,1,1,1,0,2,0,0,0,0,2,0,0,2,0,3627
"289",33552900,525260179,"9/7/2019",93704433,"Rebecca","Great comms, lovely place, and really helpful. Gutted that we didn’t get to meet Sara the pup!","Renovated & Sparkling Clean 3BR Near Harvard Sq",252824346,"Bradley",NA,"Brighton",42.36141,-71.14267,"Entire home/apt",175,3,26,"2/16/2020",1.2,1,0,"D14",18,0.694879228972303,0.53625011982763,"doc289",3,0,1,1,1,1,0,3,0,2,1,1,4,1,0,3,0,5828
"290",15521407,191726717,"9/8/2017",45609107,"Ben","Robin has a beautiful Victorian house in a great neighborhood of Boston right on the beach and next to public transportation.  A perfect spot to explore the city from.","Large Private room in Savin Hill",72139831,"Robin",NA,"Dorchester",42.30827,-71.0485,"Private room",75,1,178,"9/7/2020",3.39,4,303,"C11",29,0.128821867422288,0.35625585896437,"doc290",6,5,1,0,1,5,0,6,0,1,0,2,2,0,0,2,0,12501
"291",13378923,195989465,"9/21/2017",88561648,"Anna Paula","Eu e meu marido estivemos em Boston entre os dias 18 e 21 setembro deste ano de 2017 e ficamos no quarto 6 do Montgomery Place. O cômodo correspondia exatamente às imagens divulgadas e tudo estava muito limpo e organizado. A Lisa entrou em contato conosco antecipadamente para saber o horário em que chegaríamos e nos recebeu para o check in. Não há vaga para veículos e realmente o estacionamento em Boston é difícil. As vagas na rua são apenas para moradores. Porém, a Lisa nos indicou um estacionamento próximo para deixarmos o carro e tudo ocorreu bem. A localização é excelente! Embora não disponibilizem café da manhã, Katy e Lisa equiparam o frigobar com yogurtes, sucos e leite. Também havia cereais no armário da copa, além de utensílios de cozinha e microondas. Recomendo e voltaria outras vezes!","Montgomery Place - Studio (Room 6)",75997654,"Kathe",NA,"South End",42.34347,-71.07368,"Entire home/apt",100,29,159,"9/19/2020",2.85,3,80,"D4",147,0.0164845118348947,-0.0207070953140163,"doc291",6,5,0,0,0,5,1,41,5,2,4,15,14,1,0,9,44,11261
"292",33016886,671163781,"10/4/2020",149857363,"Savannah","Great room and nice host.","En suite w/ King bed (Boston Common)",248463000,"John",NA,"Roxbury",42.32342,-71.06924,"Private room",30,1,115,"2/15/2021",5.15,4,80,"B2",5,NA,0.447213595499958,"doc292",2,0,0,0,1,0,0,2,0,0,0,0,1,0,0,0,0,14525
"293",6261296,125573098,"1/6/2017",92028618,"Jie","My boyfriend and I spent our one-week vacation at Yedan's place. Yedan's family was very hospitable and accommodating. We were treated with hot tea right after we got the place and also a breakfast the day we checked out. Additionally, The transportation and job hunting advice they provided to us was really helpful! 
I love the clean and comfortable room especially when it was filled with sunshine! The surrounding is super convenient, which has USPS, library and many local restaurants and cafe. Definitely a good place to stay when you arrive Boston!","Free parking, 1 private room",7614614,"Yedan",NA,"West Roxbury",42.29019,-71.15638,"Private room",50,2,106,"3/20/2020",1.52,1,261,"E5",93,0.230602745961506,0.448734001991996,"doc293",11,5,10,5,7,7,0,19,1,3,12,3,11,1,0,11,0,3956
"294",31675705,408014403,"2/3/2019",6887961,"Peter And Karen","Had a great stay at Matt's place.  The place was comfortable and as described, the neighborhood was nice, and Matt was a top notch host!","Bedroom in a sunny, cozy, + colorful JP apartment",18338326,"Matt",NA,"Jamaica Plain",42.2961,-71.11484,"Private room",39,29,18,"3/7/2020",0.72,2,262,"E13",25,0.199702712377121,0.330193378647823,"doc294",4,1,1,3,2,4,0,6,0,1,0,2,4,0,0,2,0,5214
"295",60029,4880618,"5/30/2013",6418478,"Hugo","Séjour très agréable, bien accueillis par Michelle qui est un super guide de Boston. Le petit déjeuner était complet et fait maison. A noter, le logement se situe à 20 min (marche + metro) du centre ville. Une bonne première expèrience Bostonienne.
-----

Very pleasant, well received by Michelle is a great guide to discover Boston. The breakfast was complete and homemade. Note the accommodation is 20 min (walking + subway) from the city center. A good first experience Boston.
","Room in geographical heart of Hub",255183,"Michelle",NA,"Roxbury",42.32546,-71.08894,"Private room",78,14,141,"8/13/2019",1.14,5,171,"B2",80,0.356791641078172,0.35377771806495,"doc295",12,3,4,3,1,6,0,27,2,1,2,9,16,0,2,4,3,14525
"296",1692573,339965686,"10/22/2018",12333205,"Michael","This is a really beautiful apartment in a beautiful house in one of the nicest neighborhoods in Boston. The place is very clean, the owners are very responsive. One of the best places I have stayed, period.","Urban oasis trendy JP 'hood - suite",8814724,"Kelly",NA,"Jamaica Plain",42.31338,-71.11719,"Entire home/apt",145,29,213,"8/12/2020",2.39,1,325,"E13",37,0.402107147774663,0.630859999458513,"doc296",6,5,3,4,0,6,0,7,2,0,2,1,5,0,0,1,0,5214
"297",7239024,561067165,"11/8/2019",300107848,"Lori","This was our second stay with Polly.  We enjoyed our stay once again.  
It is a clean home and it was nice to be able to cook some of our meals in.  
The bus stop was a 2 min walk and took us to the train station and we were able to get around town very well with the Boston transportation.  We even walked to the train station a couple of days.
It was our first experience of sharing common area but we enjoyed visiting with the other guest while we were there and it was not awkward at all.
I also really enjoyed the gym in the basement! 
I highly recommend staying at Molly’s Airbnb.","M&R Quiet Back Room Parking Bathroom",7988017,"Polly Minter",NA,"Dorchester",42.29263,-71.05575,"Private room",52,2,199,"2/16/2021",2.91,3,358,"C11",116,0.220575268939325,0.330506537568175,"doc297",8,10,13,9,5,11,0,21,1,5,17,4,8,2,0,11,0,12501
"298",28054656,363848886,"12/29/2018",231189191,"Neymar","She is super host that will listen to demands of her guests. She keeps her place clean and neat. She will make arrangements to make your check in or check out fit your flights, which very important to us guests.","#B103 Boston Private room Central AC <U+5168><U+697C><U+7981><U+70DF>",105851798,"Anne",NA,"Dorchester",42.29737,-71.06192,"Private room",50,29,18,"11/16/2019",0.6,11,357,"C11",40,0.243418190950677,0.356254179395158,"doc298",3,5,2,3,2,0,0,7,0,1,10,0,4,0,0,7,0,12501
"299",25326962,402480439,"1/18/2019",8324920,"Sébastien","Super","Private parking(sedan size), clean, comfy room@3",183805757,"Claire",NA,"East Boston",42.36819,-71.03993,"Private room",53,1,185,"1/17/2021",5.54,3,35,"A7",1,NA,0.75,"doc299",0,0,1,0,0,0,0,0,0,0,0,0,0,0,0,0,0,3627
"300",163941,11129910,"3/22/2014",10331873,"Lisa","Terry a été très accueillant. Il nous a donné des conseils et des infos sur Boston. L'appartement est superbe, très grand, très propre. Linge propre et drap disponible. L'appartement est à 5min à pied d'une station de métro. Le quartier est calme et sympathique. Je vous le recommande.","$99* SPECIAL* 2 bed ApT! Location!",8229,"Terry",NA,"Roxbury",42.32965,-71.09503,"Entire home/apt",231,29,228,"12/30/2019",1.97,4,1,"B2",50,0.0629940788348712,0.0695906185476331,"doc300",8,0,0,0,1,2,0,23,1,0,0,6,9,0,0,4,5,14525
"301",19358947,353574942,"11/28/2018",19750794,"Stephen","The apartment was stylish and clean, just as shown in the photos. Phenomenal location right on the Common. The host was extraordinarily accommodating when my flight was delayed and I showed up in the middle of night six hours after our scheduled meeting time. Highly recommended.","Downtown- on the Boston Common",799496,"Kj",NA,"Downtown",42.35195,-71.0651,"Entire home/apt",79,29,201,"2/6/2021",4.5,3,182,"A1",46,0.32117271034945,0.457123822820429,"doc301",3,5,5,3,2,5,0,11,1,0,3,0,5,2,0,6,0,9706
"302",4090224,56353753,"12/12/2015",49991670,"Rachel","This place was awesome, exactly as described and located on a cute quite street.  Thanks Tiffany!","Sanitized Modern 3BD private home-near BCEC",17783651,"Tiffany",NA,"South Boston",42.3357,-71.05395,"Entire home/apt",170,1,592,"1/31/2021",7.63,1,282,"C6",16,0.0685153611839966,0.472711745220578,"doc302",2,1,1,1,1,2,0,4,0,0,0,1,3,1,0,2,0,6984
"303",18858706,569745732,"11/27/2019",60651849,"Lauren","Great space! quick responses! Lots of recommendations to great foods places and very detailed check-in. I recommend","Shabby-Chíc Condo Steps to Airport & Subway",16284736,"Jordan",NA,"East Boston",42.37538,-71.03431,"Entire home/apt",115,29,291,"1/3/2021",6.4,3,3,"A7",18,0.173458555279053,0.447372809336588,"doc303",4,3,1,0,1,0,0,6,0,0,1,0,4,0,0,2,0,3627
"304",990668,168500327,"7/9/2017",43510578,"Eric And Danny","Our stay at Edward's place was simply superb. Bedroom, bathroom, kitchen, and living spaces were clean and beautifully decorated. Edward was a grand host, making us feel right at home from the moment we got there. We can't thank him enough for his generous hospitality and look forward to returning soon!","<U+2714>Arlington<U+2714>Skydeck <U+2714>Walk Score 95<U+2714>Full Kitchen",1651480,"Edward",NA,"South End",42.34232,-71.07595,"Private room",119,29,293,"3/17/2020",3.12,4,0,"D4",51,0.116962680093078,0.434678056155158,"doc304",4,4,7,4,3,2,0,10,0,2,6,3,8,1,0,7,0,11261
"305",7476340,202034722,"10/9/2017",147606041,"Carlos","Los próximos huéspedes deben saber:
Que NO hay ascensor para subir al cuarto piso (Muy importante para personas mayores, sobre todo al momentos de subir o bajar las valijas).
Que el cuarto es chico. Sugiero que publiquen sus medidas. 
Que la cama es muy pequeña para dos personas.
Que la cocina no está bien equipada.
Que resulta muy incomodo tener que salir de la habitación para ir al baño.
Que la ubicación es muy buena.","Charming Studio in Boston Brownstone, #44",22348222,"Maverick",NA,"South End",42.34441,-71.07633,"Entire home/apt",60,1,80,"11/20/2020",1.69,55,337,"D4",81,0.0169711058325533,-0.0187482660937166,"doc305",5,1,0,0,0,2,0,31,1,0,0,2,11,0,0,2,31,11261
"306",533152,173115127,"7/22/2017",136952352,"Elizabeth","We truly enjoyed staying in the Penthouse.  Loved the views from the balcony.  the neighborhood was a little noisy, but not a problem.  The apartment was comfortable and clean.  We would definitely come back!","The Penthouse Redline | 2BR 1BA | Walk to the Redline for UMass and Mass General!",71783,"Lance",NA,"Dorchester",42.32212,-71.06096,"Entire home/apt",113,32,56,"8/1/2020",0.67,42,335,"C11",34,0.270980123226303,0.389229072680598,"doc306",4,2,4,3,2,7,0,6,0,0,2,0,6,0,0,4,0,12501
"307",4863108,28653580,"3/28/2015",27529735,"Alison","John was a helpful host and the space was exactly as listed - so nice to have use of my own (clean!) bathroom, and the kitchen amenities are great. The neighborhood is also within walking distance of downtown, if you're up for a pleasant 20- or 30-minute jaunt.","Ensuite Private Room in Boston",8157833,"John",NA,"South Boston",42.33775,-71.05145,"Private room",92,3,213,"1/3/2021",2.87,1,342,"C6",46,0.167409885723864,0.354078925828525,"doc307",6,5,4,5,3,5,0,12,2,1,2,1,10,1,0,2,0,6984
"308",33013194,635931039,"7/8/2020",205757732,"Cheirsh","John was a fabulous host. He checked in every other day, kept the place cleaned daily. I loved the fresh water and kitchen utensils that came handy.","Bright, cozy bedroom (Freedom Trail)",248463000,"John",NA,"Roxbury",42.32232,-71.06847,"Private room",30,1,110,"2/15/2021",4.76,4,118,"B2",27,0.226138213766101,0.23860927939546,"doc308",3,1,2,1,1,4,0,6,0,0,3,1,4,0,0,5,0,14525
"309",2000797,158414105,"6/6/2017",129776865,"Jacquie","Jessica is very responsive and open to helping with whatever you need. If you need more privacy, this could be a challenging space. Very clean!","Sea view,balcony,15min by metro to center,safe st",9898255,"Jessica",NA,"Dorchester",42.31502,-71.06115,"Private room",70,29,143,"11/3/2019",1.77,5,315,"C11",25,0.655150193924348,0.434200620954135,"doc309",5,0,2,3,1,1,0,2,0,0,4,1,4,3,0,3,0,12501
