"","id","id_review","date","reviewer_id","reviewer_name","comments","name","host_id","host_name","neighbourhood_group","neighbourhood","Lat","Lon","room_type","price","minimum_nights","number_of_reviews","last_review","reviews_per_month","calculated_host_listings_count","availability_365","district","word_count","sd","ave_sentiment","doc_id","ADJ","ADP","ADV","AUX","CCONJ","DET","INTJ","NOUN","NUM","PART","PRON","PROPN","PUNCT","SCONJ","SYM","VERB","X","crime"
"720",4278067,580948224,"12/23/2019",266208956,"Ramses","Great stay at Glenn's place in Boston.","Studio apart Tremont St South End #2",9653086,"Glenn",NA,"South End",42.34128,-71.07607,"Entire home/apt",60,33,69,"12/21/2020",0.89,6,300,"D4",7,NA,0.188982236504614,"doc720",1,2,0,0,0,0,0,2,0,1,0,2,1,0,0,0,0,11261
"721",18756360,244757517,"3/19/2018",139504613,"Will","Good quiet location near the Orange Line train.
Bring an eye mask for sleep.","Comfortable Stay, not far from Downtown and Fenway",101057334,"Gregory",NA,"Roxbury",42.33157,-71.09498,"Private room",52,1,195,"2/3/2021",4.26,4,174,"B2",14,0.25,0.192929252116487,"doc721",1,2,0,0,0,2,0,6,0,0,0,2,2,0,0,1,0,14525
"722",23633083,538341992,"9/29/2019",83306384,"Megan E","The space was super cute and very convenient. Fatima gave us great advice about things to do in Boston. And on top of it all, the place was very clean. Definitely would stay here again!","Hilltop5- 2 Doublebeds 4.6m to BCEC near T freeprk",95762630,"Fatima",NA,"Dorchester",42.3036,-71.06363,"Private room",195,29,68,"10/14/2020",1.89,6,309,"C11",35,0.57074876192522,0.550777888096207,"doc722",4,4,6,3,2,3,0,5,0,1,2,2,5,0,0,3,0,12501
"723",3294152,45483986,"9/3/2015",2527260,"Cliff","Jessica is a delight and provided us with another wonderful AirBNB experience, lots of helpful information about the local area, things to do, places to go and above all else a great place to stay, all our own.  We would absolutely recommend this fully furnished and equipped private apartment to anyone looking to visit Boston.  The apartment is clean, quiet and comfortable, and just a short walk to the subway for quick, easy and affordable travel downtown on the Red Line.","Garden Suite near subway, beach",9898255,"Jessica",NA,"Dorchester",42.31503,-71.06214,"Entire home/apt",100,29,203,"2/14/2021",2.51,5,349,"C11",81,0.166462832861604,0.615183649494847,"doc723",14,8,3,3,6,10,0,14,0,4,5,4,10,0,0,10,0,12501
"724",1275498,48998953,"9/30/2015",34301987,"Bharti","After much challenges with Air B&B, I finally managed to get confirmation for Laura ' s first floor apartment in September. I had gone by only the Reviews when confirming and am so glad that I did! The feedback that I read was all that I experienced in my one month stay in September ! Laura was the perfect host, ensuring comfort at all times including loaning an air mattress when my son was visiting; a blender from her own personal kitchen to prepare my Indian meals for my son; etc. The place is so central and the time flew by very quickly! Apartment is super clean with good linen and kitchen items. Perhaps the 2 things Laura could add to make it perfect is a chest of drawers as there is no proper closet to organize personal clothes and fix the window curtains in the room. Overall, a wonderful experience and am glad I found this place. Will definitely recommend to people for short or long term stay. Thank you Laura","The Upton Boston - The Washington",5430185,"Laura And Olivia",NA,"South End",42.34294,-71.07304,"Entire home/apt",141,2,52,"2/14/2021",0.57,7,169,"D4",170,0.246643183136472,0.331853376685949,"doc724",17,15,13,11,6,16,0,38,2,6,16,8,14,2,0,20,1,11261
"725",29929936,437954179,"4/15/2019",240353943,"Jasmin","Very helpful and friendly host, super clean and nice room, good location for seeing Brighton with easy bus links to get into the city. It was perfect for getting to Boston College on a daily basis (just a half hour walk) and to explore the wider city (via the bus and T links). Thanks Helen!","Lily Room/Harvard Business School/free parking+<U+65E9><U+9910>",224379152,"Tingying(Helen)",NA,"Brighton",42.35209,-71.15272,"Private room",66,30,16,"8/31/2020",0.58,3,277,"D14",55,0.591317094085976,0.61310382668143,"doc725",10,5,3,1,4,5,0,14,0,2,1,4,9,2,0,4,0,5828
"726",7900936,51306094,"10/19/2015",17414571,"Linda","Let me say this... if we lived next door to Chris, I could be best friends. Right from the moment we met, we felt welcomed and at home. She showed us our room and bathroom, gave us a key and said to make ourselves at home. Mocha Joe is a sweet, mellow cat that purred his 'hello'. The house and our room were better as advertised. Had it been warmer we would have spent time on our little deck. Chris' flair for color and style is everywhere, as are her beautiful watercolors and pastels. We have stayed in many B&B's but were only offered breakfast in one...until Morning Glory. Even though we were leaving early on Sunday morning, Chris made a wonderful breakfast - coffee, fruit, cider and a delicious German pancake with real maple syrup. I would return just to visit! Thank you so much Chris.","Morning Glory Bed & Breakfast!",41658743,"Chris",NA,"Hyde Park",42.24179,-71.12412,"Private room",75,29,131,"11/30/2019",1.95,1,365,"E18",148,0.180706435041386,0.212803591510311,"doc726",14,10,7,13,8,6,0,28,1,4,22,11,24,5,0,20,0,5280
"727",24119260,618554349,"3/15/2020",153449810,"William","Vincent was a very accommodating and polite host. Location was great for my events and the place was very clean. Would recommend!","Private Room& Bath Near Everything <U+0001F3F3><U+FE0F><U+200D><U+0001F308>",39730545,"Vincent",NA,"South End",42.34475,-71.07069,"Private room",50,29,107,"2/7/2021",3.05,2,90,"D4",22,0.115772979127563,0.401933480375875,"doc727",4,1,2,4,2,2,0,4,0,0,1,1,3,0,0,1,0,11261
"728",13829133,335573107,"10/12/2018",41470670,"Michael","Very responsive and accommodating!","Sunny studio in JP!",45771009,"Riyo",NA,"Jamaica Plain",42.31798,-71.10875,"Entire home/apt",95,5,218,"12/28/2020",4.16,2,231,"E13",4,NA,0.675,"doc728",2,0,1,0,1,0,0,0,0,0,0,0,1,0,0,0,0,5214
"729",533152,613058775,"3/1/2020",50625594,"Roos","It’s a beautiful place in a great location! It is even better than in the pictures and it’s really big! We really enjoyed the stay we had here.","The Penthouse Redline | 2BR 1BA | Walk to the Redline for UMass and Mass General!",71783,"Lance",NA,"Dorchester",42.32212,-71.06096,"Entire home/apt",113,32,56,"8/1/2020",0.67,42,335,"C11",30,0.151167178677214,0.466583464125109,"doc729",4,3,4,3,1,4,0,4,0,0,5,0,3,0,0,2,0,12501
"730",29901892,458793888,"5/26/2019",81139804,"Grecia","Amazing place and the host was really nice to us","Karlie’s Place #1",192503522,"Esther",NA,"Mattapan",42.2749,-71.09584,"Private room",45,1,41,"12/24/2020",1.51,4,170,"B3",10,NA,0.442718872423573,"doc730",2,1,1,1,1,1,0,2,0,0,1,0,0,0,0,0,0,11007
"731",7281884,117203620,"12/5/2016",50286493,"Stephen","Bathtub is a serious/disturbing issue, needs a lot of improvement. Parking is a problem, way too small to navigate around with a SUV, lost my ""free"" space one night. Not really a private home, when other people are also living in the house. Studio temperature is cold, except for the bathroom. No water bottles provided. To cook, you use a portable stove. Neighborhood is average, yet close to downtown Boston (15 minutes or less.) 3.5 out of 5 stars. Finally, the host was very friendly and nice to talk to! Thank you!","Charming urban studio",25742899,"Tyree",NA,"Roxbury",42.31289,-71.08316,"Entire home/apt",73,91,110,"8/22/2017",1.62,1,0,"B2",90,0.443197637602219,0.0654829788885442,"doc731",13,9,9,6,2,10,0,21,4,4,3,3,23,0,0,9,0,14525
"732",20723594,651601269,"8/15/2020",72770788,"Nancy","Great location and parking. Perfect for a temp stay needed inbeteeen miving apartments!","Lower level private room and bath in Savin Hill",72139831,"Robin",NA,"Dorchester",42.30826,-71.04816,"Hotel room",75,1,105,"1/24/2021",2.49,4,321,"C11",13,0,0.25,"doc732",2,2,0,0,1,1,0,6,0,0,0,0,2,0,0,1,0,12501
"733",4863108,250003698,"4/3/2018",90638809,"Mimi","Great place located near terrific restaurants, quick walk to main street. Dan was super with communication and helpful how to find coveted parking spaces.  No issues walking alone at night. Nice comfortable apartment with kitchen access. Convenient to get on and off the highway when driving, not far from the T and lots of Uber options when I needed them.","Ensuite Private Room in Boston",8157833,"John",NA,"South Boston",42.33775,-71.05145,"Private room",92,3,213,"1/3/2021",2.87,1,342,"C6",60,0.222844351377314,0.472879449109429,"doc733",8,9,7,1,3,3,0,15,0,2,2,3,7,0,0,7,0,6984
"734",25685344,319903170,"9/7/2018",68367467,"Tony","Terrific stay, super comfortable and amazing location.  Maria and Travis were excellent hosts and I’ll definitely stay again.","43' Motor Yacht in Boston Harbor",316958,"Maria",NA,"Charlestown",42.37265,-71.04933,"Entire home/apt",274,2,18,"11/19/2020",0.56,1,352,"A15",19,0.397213649071023,0.569547599432787,"doc734",4,0,3,2,3,0,0,3,0,0,1,2,3,0,0,1,0,1913
"735",18170647,548415322,"10/17/2019",11153558,"Yousef","traveled to Boston for few weeks working at loongwood medical area.
 the apartment was very nice, very clean.
 I highly recommend this place, close to grocery stores, public transportation, restaurants, gym . very clean, safe and quite neighborhood. would stay here again next time.","Great 1 bedrm apt in Boston, Longwd Med",31340713,"Kama",NA,"Brighton",42.33932,-71.14603,"Entire home/apt",122,29,3,"10/17/2019",0.1,14,270,"D14",43,0.504329619055486,0.458842430654339,"doc735",8,5,6,2,1,3,0,12,0,0,1,1,11,0,0,4,0,5828
"736",1545185,277079779,"6/15/2018",172914197,"Susan","Nick's place is conveniently located within walking distance to some nice restaurants and to the train that will take you anywhere downtown.  We're southerners, so we were concerned it wouldn't stay cool enough.  However, that was not an issue at all.","Large 1 Bed, Kitchen & Bath w/ Off Street Parking",697401,"Nick",NA,"Brighton",42.3484,-71.15696,"Entire home/apt",100,1,129,"1/30/2021",1.44,4,108,"D14",41,0.169035827974217,0.220288485437781,"doc736",3,3,8,6,1,3,0,7,0,3,6,1,5,0,0,3,0,5828
"737",8402408,283353783,"6/29/2018",11119555,"Anahit","Very cozy and stylish apartment with a great location and an excellent host! If you are searching for a great place to stay during your trip to Boston, look no further :) Would love to be back some day!","Room on Top - South End brownstone",44162105,"Betsy",NA,"Roxbury",42.33674,-71.07878,"Private room",80,29,420,"3/13/2020",6.87,1,79,"B2",38,0.752813785258356,0.782319732526897,"doc737",5,4,4,3,2,4,0,6,0,2,2,1,3,1,1,4,0,14525
"738",17541222,486366738,"7/12/2019",223931924,"Karen","The apartment was very nice and clean with plenty of space. Great to have a kitchen, dining table and other amenities. Only a few blocks near cute restaurants and other amenities.","Room for up to 4 in Updated 1 BR apt by T!",18150109,"Alex",NA,"Roxbury",42.32874,-71.09399,"Entire home/apt",149,91,159,"12/9/2019",3.29,4,0,"B2",31,0.354928656833434,0.278853947491097,"doc738",7,3,2,1,3,3,0,10,0,1,0,0,4,0,0,1,0,14525
"739",1544144,331761364,"10/3/2018",73212031,"Jo","Tom and Nancy's home in Boston was perfect for the five days we spent touring the Boston area. Even though it isn't located in the busy downtown area of Boston, we were still able to park the car, and walk, take the bus, ferry, or the T and to get around to all the sights we wanted to see.  Tom and Nancy added many amenities, such as food for our group including a freshly made Tortilla Patata's, and even had a plate of fresh macaroons on the counter when we arrived. They asked ahead of time about any dietary needs, and tried to have the appropriate foods on hand. There were fresh flowers in almost every room. Tom and Nancy went above and beyond, to make sure we had a pleasant stay. I hope we can get back there again some day.","Charming Historic Home in Charlestown",7353037,"Nancy And Tom",NA,"Charlestown",42.37203,-71.06165,"Entire home/apt",350,3,14,"8/3/2020",0.41,1,217,"A15",142,0.167114124406427,0.235187117140702,"doc739",11,13,13,4,9,16,0,23,1,8,11,12,16,1,0,23,0,1913
"740",27501160,531454724,"9/17/2019",294073889,"Abdalla","A nice and comfy condo in Eastie with a great host. If you're looking for a place around that area this is perfect.","Adorable clean & quiet 1BR with everything u need!",101356888,"Erik",NA,"East Boston",42.37305,-71.04015,"Entire home/apt",99,29,76,"12/19/2020",2.48,1,285,"A7",23,0.273308323787272,0.409764520050818,"doc740",4,4,0,2,1,4,0,4,0,0,2,1,2,1,0,1,0,3627
"741",8231382,177702100,"8/3/2017",48011868,"Michelle","Good location close enough to walk to public transportation, though we used Uber.","*** Sunny Studio *** near Airport & Train stop",23777641,"Gavin",NA,"East Boston",42.37594,-71.03634,"Entire home/apt",59,60,152,"3/2/2020",2.38,2,17,"A7",13,NA,0.138675049056307,"doc741",3,1,1,0,0,0,0,2,0,1,1,1,2,1,0,2,0,3627
"742",1821633,35776039,"6/22/2015",29001773,"Laura","It was close proximity to bus line to go to many places in Boston. The house had authentic style with modern conveniences. It was very nice to have breakfast every morning before sightseeing. Barry gave great tips on what to see and where to go.","Queen Size Four Poster Bed",7799789,"Bruce",NA,"Dorchester",42.30958,-71.04792,"Private room",100,29,211,"3/7/2020",2.37,3,365,"C11",45,0.264022360243689,0.294904802119067,"doc742",6,4,2,2,1,2,0,10,0,4,3,2,4,2,0,7,0,12501
"743",798957,237339150,"2/22/2018",98530594,"Daphne","<U+6559><U+6388><U+7684><U+5BB6><U+79BB><U+6CE2><U+58EB><U+987F><U+56FE><U+4E66><U+9986><U+548C><U+4E09><U+4E00><U+6559><U+5802><U+5F88><U+8FD1>,<U+51FA><U+95E8><U+8D70><U+51E0><U+6B65><U+5C31><U+662F><U+79D1><U+666E><U+5229><U+5E7F><U+573A><U+548C><U+4FDD><U+5FB7><U+4FE1><U+5927><U+53A6><U+FF61><U+5230><U+4E4B><U+524D>,<U+6559><U+6388><U+7ED9><U+6211><U+4EEC><U+53D1><U+4E86><U+4E00><U+5C01><U+5F88><U+957F><U+7684><U+4FE1><U+606F>,<U+5F88><U+8BE6><U+7EC6>,<U+4F46><U+4E5F><U+5F88><U+590D><U+6742>,<U+5F00><U+95E8><U+8981><U+6709><U+4E09><U+4E2A><U+5BC6><U+7801><U+FF61><U+4E09><U+70B9><U+4E4B><U+524D><U+53EF><U+4EE5><U+653E><U+884C><U+674E><U+4F46><U+4E0D><U+80FD><U+5165><U+4F4F>,<U+8D70><U+5230><U+90A3><U+5929><U+4E5F><U+5FC5><U+987B><U+5341><U+4E00><U+70B9><U+4E4B><U+524D><U+79BB><U+5F00><U+FF61><U+95E8><U+524D><U+6709><U+9AD8><U+9AD8><U+7684><U+53F0><U+9636>,<U+4F46><U+6211><U+4EEC><U+4F4F><U+7684><U+5730><U+65B9><U+662F><U+4ECE><U+4FA7><U+8FB9><U+4E00><U+4E2A><U+5C0F><U+95E8><U+8FDB><U+53BB><U+7684><U+FF61><U+623F><U+95F4><U+5206><U+4E24><U+5C42>,<U+4E00><U+5C42><U+662F><U+5BA2><U+5385>,<U+53A8><U+623F><U+548C><U+4E00><U+4E2A><U+536B><U+751F><U+95F4>,<U+4E8C><U+697C><U+662F><U+4E24><U+4E2A><U+5367><U+5BA4><U+548C><U+4E00><U+4E2A><U+536B><U+751F><U+95F4>,<U+90FD><U+5F88><U+5E72><U+51C0><U+6574><U+6D01><U+FF61><U+623F><U+95F4><U+91CC><U+6446><U+6EE1><U+4E86><U+4E66>,<U+5F88><U+6709><U+5B66><U+672F><U+6C14><U+606F><U+FF61><U+4E0D><U+77E5><U+9053><U+6559><U+6388><U+662F><U+4E0D><U+662F><U+7279><U+559C><U+6B22><U+4E9A><U+6D32><U+6587><U+5316>,<U+623F><U+95F4><U+91CC><U+6446><U+6EE1><U+4E86><U+6765><U+81EA><U+4E2D><U+56FD>,<U+6CF0><U+56FD>,<U+65E5><U+672C><U+7684><U+4F5B><U+50CF>,<U+5C4F><U+98CE><U+FF61><U+6559><U+6388><U+5C31><U+4F4F><U+5728><U+697C><U+4E0A>,<U+6211><U+4EEC><U+5165><U+4F4F><U+540E><U+8FD8><U+6765><U+548C><U+6211><U+4EEC><U+6253><U+4E86><U+62DB><U+547C><U+FF61>
    <U+5730><U+7406><U+4F4D><U+7F6E><U+76F8><U+5F53><U+597D>,<U+9664><U+4E86><U+6211><U+524D><U+9762><U+63D0><U+5230><U+7684>,<U+9644><U+8FD1><U+8FD8><U+6709><U+4E00><U+4E2A><U+5927><U+8D85><U+5E02>,<U+53EF><U+4EE5><U+4E70><U+6C34><U+679C>,<U+5373><U+98DF><U+7684><U+98DF><U+7269>,<U+8FD8><U+6709><U+96F6><U+98DF>,<U+6C34><U+FF61><U+9644><U+8FD1><U+6709><U+4E00><U+4E2A><U+53EB>Lord&Taylor<U+7684><U+5546><U+573A><U+4E00><U+5B9A><U+8981><U+901B>,<U+4E8C><U+697C><U+5168><U+662F><U+5404><U+79CD><U+6253><U+6298><U+5973><U+88C5>,<U+53EF><U+4EE5><U+638F><U+51FA>20<U+5200><U+4E00><U+4EF6><U+7684>TOMMY<U+6253><U+5E95><U+886B>,<U+8FD8><U+6709>50<U+5200><U+4E00><U+4EF6>CK<U+897F><U+670D>,<U+8FD8><U+6709><U+5F88><U+591A><U+793C><U+670D><U+FF61>
    <U+8D2D><U+7269><U+4E2D><U+5FC3><U+91CC><U+6709><U+5F88><U+591A><U+9910><U+9986>,<U+6211><U+4EEC><U+5C1D><U+8BD5><U+4E86><U+4E00><U+4E2A><U+610F><U+5927><U+5229><U+9910><U+5385>,<U+63A8><U+8350>,<U+52A0><U+6CB9><U+4E00><U+5BB6>Atlantic Fish Company,<U+91CC><U+9762><U+7684><U+6D77><U+9C9C><U+8D85><U+7EA7><U+68D2><U+FF61>

<U+6CE8><U+610F>:
1.<U+6240><U+4EE5><U+95E8><U+628A><U+624B><U+4E0A><U+7684><U+9501><U+662F><U+4E0D><U+80FD><U+52A8><U+7684>,<U+5426><U+5219><U+628A><U+81EA><U+5DF1><U+9501><U+5728><U+5916><U+9762><U+9700><U+8981><U+82B1>150<U+5200><U+8BF7><U+5F00><U+9501><U+5320>
2.<U+6559><U+6388><U+4F1A><U+7ED9><U+4F60><U+53D1><U+6765><U+4FE1><U+606F><U+8BA9><U+4F60><U+6CE8><U+610F><U+5783><U+573E><U+5206><U+7C7B>,<U+900F><U+660E><U+888B><U+5B50><U+88C5><U+53EF><U+56DE><U+6536><U+7684>,<U+6BD4><U+5982><U+5851><U+6599><U+74F6>,<U+9178><U+5976><U+76D2><U+8981><U+6D17><U+5E72><U+51C0><U+653E><U+8FDB><U+53BB>,<U+7070><U+8272><U+888B><U+5B50><U+653E><U+4E0D><U+53EF><U+56DE><U+6536><U+7684>,<U+53A8><U+4F59><U+8981><U+76F4><U+63A5><U+7528><U+6C34><U+6C60><U+91CC><U+7684><U+98DF><U+7269><U+5904><U+7406><U+673A><U+7C89><U+788E><U+6389><U+FF61>

<U+603B><U+4F53><U+6765><U+8BF4>,<U+76F8><U+5F53><U+63A8><U+8350>,<U+8212><U+9002><U+5EA6>,<U+5E72><U+51C0><U+5EA6>,<U+5730><U+7406><U+4F4D><U+7F6E>,<U+90FD><U+4E0D><U+9519>!","<U+2605>Discounted<U+2605> NearHospitals<U+2605>2floors<U+2605> 2 Baths,2beds",1651480,"Edward",NA,"South End",42.34232,-71.07594,"Entire home/apt",261,28,418,"8/1/2020",4.4,4,0,"D4",7,NA,0,"doc743",1,0,0,0,0,0,0,10,0,0,0,1,7,0,0,0,0,11261
"744",29261726,540459735,"10/3/2019",23846435,"John","A compact comfortable apartment, it is centrally located being only a few minutes walk down Meridien Street to the Blue Line metro and one stop into the beating heart of beautiful Boston.","Beautiful private place#2 4 min fr T, 5 mt airport",169902109,"Endang",NA,"East Boston",42.37469,-71.03891,"Private room",89,29,104,"11/1/2020",3.64,2,260,"A7",32,NA,0.159072509262679,"doc744",4,4,2,2,1,4,0,4,1,0,1,6,2,0,0,3,0,3627
"745",24940375,301066940,"8/3/2018",59602587,"Brendan","Easy access to Boston via the T","Room with FREE breakfast and parking",188551199,"Olga",NA,"Dorchester",42.32741,-71.05877,"Private room",199,1,47,"3/1/2020",1.41,7,294,"C11",7,NA,0.302371578407382,"doc745",1,2,0,0,0,1,0,1,0,0,0,2,0,0,0,0,0,12501
"746",22940115,281190048,"6/24/2018",135489897,"Larry","Clean and comfortable lodging and wonderful hospitality.  Great value as everything you need is there to make your stay peaceful and convenient.","Beautiful private place, 4 min fr T, 5 min airport",169902109,"Endang",NA,"East Boston",42.38318,-71.03455,"Private room",89,29,153,"8/30/2020",4.14,2,359,"A7",22,0.42750664477541,0.831600571504681,"doc746",6,1,0,0,3,0,0,4,0,1,4,0,2,0,0,3,0,3627
"747",1881298,265012777,"5/15/2018",60389860,"Shari","Great apartment and location.","Private Apartment- Minutes from T!",1920539,"Caitlin & Dan",NA,"Jamaica Plain",42.30026,-71.11181,"Entire home/apt",117,1,538,"12/12/2020",6.07,1,310,"E13",4,NA,0.25,"doc747",1,0,0,0,1,0,0,2,0,0,0,0,1,0,0,0,0,5214
"748",9731479,350179879,"11/18/2018",22777473,"Mark","Great host wonderful place","Penthouse South End with roof deck",19013294,"Yoshika",NA,"South End",42.34568,-71.06943,"Entire home/apt",120,91,166,"11/10/2019",2.71,1,0,"D4",4,NA,0.625,"doc748",2,0,0,0,0,0,0,2,0,0,0,0,0,0,0,0,0,11261
"749",26360101,471548876,"6/17/2019",176214371,"Jane","the apartment is 1min walk from the subway station. Very close to the airport but still very quiet. Hanqing has prepared everything we would possibly need and provided great recommendations for our trip. Would stay here again if visit Boston another time","H-kingdom | Smart Home | Cozy renovated",73201898,"Hanqing",NA,"East Boston",42.38998,-70.99701,"Private room",68,1,59,"11/1/2020",1.85,1,334,"A7",42,0.197309018988742,0.222373348331088,"doc749",3,4,6,4,2,4,0,8,0,0,3,2,3,1,0,5,0,3627
"750",2892825,33703242,"5/31/2015",23914559,"Lucy","The neighborhood is unexpected, siren and loud music at night almost every night, though the interior of the house is clean, landlord lives right upstairs, so we can always hear steps early in the morning.","Luxury Sunny Hill Garden Townhouse Suite 1",14785487,"Aihua",NA,"Roxbury",42.31018,-71.08543,"Entire home/apt",450,28,14,"8/31/2019",0.19,4,365,"B2",35,NA,0.223120723248328,"doc750",5,3,6,3,1,5,0,9,0,0,1,0,5,1,0,1,0,14525
"751",5371051,83140073,"7/1/2016",57690863,"Eric","The house is really beautiful! Nice furnitures, good equipments also with a lovely balcony where you can enjoy your beers with some breeze. Me and my family had a good stay there, it's the best offer I've ever seen in Airbnb: 3 bedrooms & kitchen & living room & balcony with this price! It's impossible to find a more proper house for family trip like this.","Beautiful 3 bedroom Dorchester MA",27842033,"Bernard",NA,"Dorchester",42.31339,-71.06526,"Entire home/apt",95,28,260,"11/25/2020",4.07,2,180,"C11",62,0.209076922530349,0.459722675143653,"doc751",8,6,6,5,4,7,0,19,1,1,8,0,7,0,0,4,0,12501
"752",24484501,609930335,"2/23/2020",118821504,"Tyler","Great place for a guys weekend or bachelor party! We spent most of the weekend exploring the city but it was a great place to hang out with a large group. Tons of beds and places to sleep. The pub downstairs was a fun spot with live music and the bartenders were very nice. Definitely would recommend spending a weekend here.","Top of the World",114515516,"William",NA,"Charlestown",42.38266,-71.0791,"Entire home/apt",600,2,85,"1/3/2021",2.53,1,313,"A15",61,0.202343969395496,0.329060279384864,"doc752",7,7,4,4,4,9,0,18,0,1,2,0,5,0,0,5,0,1913
"753",29704910,428073399,"3/24/2019",86766289,"Craig","The apartment is stylish and clean. Aaron is a great host.","Bright & Spacious Loft Steps to Boston Common",771785,"Aaron",NA,"Downtown",42.35529,-71.06087,"Entire home/apt",170,3,86,"11/29/2020",3.44,1,310,"A1",11,0.289332575613541,0.428195823984483,"doc753",3,0,0,2,1,2,0,2,0,0,0,1,2,0,0,0,0,9706
"754",14566386,712351574,"11/29/2020",122689623,"Sarah","Elena’s place was a pleasure! Outdoor space was even larger than it seemed from the website, making it easy to have socially distant visitors outside. Elena was very helpful.","Fully-Equipped Private 1 Bedroom 2nd Floor Apt",25938192,"Elena",NA,"Jamaica Plain",42.31637,-71.10975,"Entire home/apt",130,29,147,"1/17/2021",2.76,2,329,"E13",30,0.279431184541688,0.352669861143972,"doc754",5,1,4,3,0,2,0,5,0,2,2,2,4,1,0,3,0,5214
"755",13378936,425975424,"3/19/2019",13967035,"Luke","Kathe & Lisa's place is exactly as advertised and absolutely perfect for a short break in Boston (we were there for 5 days). It is extremely clean, the bathroom/shower is great and it has all of the amenities that you would need. They even left us some yogurts and OJ in the fridge as well as throw away toothbrushes in the bathroom! 

The self-check in and check out is extremely easy (you get sent a code for the front door) which takes all of the stress away when running to our from Logan like we were! While we only briefly met Lisa and Kathe in the hallway, their communication was excellent, answering any questions we had within a couple of hours. They even gave us a recommendation for where to eat in the North End given the volume of Italian restaurants in that part of town! They allowed us to leave our bags in a different room for the day when we checked out as our flight was not until 7:30pm that evening which was also much appreciated.

The location is very good - The South End is lovely (classic Boston red-brick neighborhood) and the apartment is literally a 1 minute walk to Tremont Street which has a catalog of excellent restaurants. It took us about 10 minutes to walk to Back Bay T station, the heart of Back Bay (Boylston St/Newbury St/Commenwealth Ave.) and Boston Common so it is well located for all of the major tourist sites.

I will be recommending Kathe and Lisa's place to anyone I know travelling to Boston and hope to return one day myself! Thanks guys!","Montgomery Place - One Bedroom",75997654,"Kathe",NA,"South End",42.34347,-71.07368,"Entire home/apt",66,29,130,"6/30/2019",2.29,3,132,"D4",273,0.150332546911488,0.282286657639728,"doc755",15,34,24,17,10,30,0,46,5,7,30,28,28,3,0,29,0,11261
"756",45349044,663278377,"9/12/2020",323701440,"Zachary","Good place in a great location resturants bars stores all close by.","FOUND Boston Common - Queen Room",365985792,"FOUND Hotel",NA,"Downtown",42.34948,-71.06605,"Private room",96,1,145,"2/15/2021",26.85,5,320,"A1",12,NA,0.360843918243516,"doc756",3,2,1,0,0,1,0,4,0,0,0,0,1,0,0,1,0,9706
"757",36790111,562386300,"11/10/2019",72896009,"Gabrielle","This apartment is a wonderful space, nicely decorated space in a GREAT location. So walkable to everything around! This property is large/ spacious with a full kitchen, living area, dining area, and separate bedroom. This property would be a perfect long-term stay for two people. While the apartment building itself was quiet, the outside was very loud. If you have issues with noise be aware that construction outside of the building continued for most of the night and there is street noise. The space is neatly decorated but does need some maintenance upkeeping, which we have notified the hosts of.","Newly updated!  Financial District 5m to North End",275849638,"Steven",NA,"Downtown",42.35699,-71.05524,"Entire home/apt",126,29,65,"12/27/2020",3.37,22,204,"A1",101,0.353404794014741,0.00785731268916401,"doc757",14,10,5,10,3,15,0,27,1,0,6,0,15,2,0,8,0,9706
