"","id","id_review","date","reviewer_id","reviewer_name","comments","name","host_id","host_name","neighbourhood_group","neighbourhood","Lat","Lon","room_type","price","minimum_nights","number_of_reviews","last_review","reviews_per_month","calculated_host_listings_count","availability_365","district","word_count","sd","ave_sentiment","doc_id","ADJ","ADP","ADV","AUX","CCONJ","DET","INTJ","NOUN","NUM","PART","PRON","PROPN","PUNCT","SCONJ","SYM","VERB","X","crime"
"499",568234,215959885,"12/2/2017",38487698,"Sophia","Wonderful room and private bathroom in a beautiful house. Great neighborhood. Walking distance to many fun places to eat. Highly recommend!","Stay on your own separate floor",2796082,"Margaret",NA,"Jamaica Plain",42.3036,-71.10539,"Private room",104,1,272,"7/22/2020",2.6,2,347,"E13",21,0.115898996629937,0.491811642740522,"doc499",6,2,1,0,1,1,0,6,0,1,0,0,4,0,0,3,0,5214
"500",4090224,22104124,"10/30/2014",11036149,"Christine","C'était super. Tiffany a été très réactive pour répondre à toutes nos questions et très accommodante pour nos requêtes d'arrivée et départ tardifs. La maison est très mignonne, beaucoup mieux que sur les photos. Merci pour ce séjour agréable.","Sanitized Modern 3BD private home-near BCEC",17783651,"Tiffany",NA,"South Boston",42.3357,-71.05395,"Entire home/apt",170,1,592,"1/31/2021",7.63,1,282,"C6",49,0.209717623201965,0.15784186676345,"doc500",5,1,1,0,0,2,0,19,0,0,0,2,6,0,0,7,2,6984
"501",1161210,17419141,"8/11/2014",19629115,"Wang","<U+6211><U+5F88><U+559C><U+6B61><U+9019><U+88E1>!<U+623F><U+6771><U+5F85><U+6211><U+5011><U+5F88><U+597D>!<U+74B0><U+5883><U+548C><U+5BB6><U+90FD><U+5F88><U+7F8E>","Cozy rooms with parking and Wi-Fi <U+6CE2><U+58EB><U+987F><U+8FD1><U+90CA><U+8212><U+9002><U+7684><U+7761><U+623F><U+9644><U+5E26><U+514D><U+8D39><U+3002><U+3002>",3887707,"Emily",NA,"West Roxbury",42.27176,-71.16759,"Private room",70,29,209,"8/16/2019",2.22,1,234,"E5",0,NA,0,"doc501",0,0,0,0,0,0,0,1,0,0,0,0,0,0,0,0,0,3956
"502",1454258,89432644,"7/28/2016",82747154,"Kelsey","Bruce was very accomodating and was very helpful about things to do in the city. The place was beautiful and very clean. We would definitely stay there again of our travels brought us back to the area.","Inviting Queen Anne Victorian",7799789,"Bruce",NA,"Dorchester",42.30844,-71.0464,"Private room",80,29,311,"11/5/2019",3.39,3,365,"C11",37,0.51026698339241,0.538027371521358,"doc502",4,4,7,4,2,3,0,5,0,1,3,1,3,0,0,3,0,12501
"503",19315157,648283375,"8/8/2020",247248495,"Jasmine","Right next to an airport, and downtown Boston. Great location and very stylish!","CLEAN Smart Room w/Roof Deck Near Airport & D-town",74019501,"Adam",NA,"East Boston",42.37637,-71.03229,"Private room",63,1,457,"1/21/2021",10.25,1,363,"A7",13,0.413481866072666,0.575218543872269,"doc503",3,1,3,0,2,1,0,2,0,0,0,1,3,0,0,0,0,3627
"504",6741968,273602250,"6/6/2018",70264051,"Stephen","Tiffany is very hospitable. Lots of great little touches around the place!","Entire Loft Apt in Prestigious Beacon Hill",28662502,"Tiffany",NA,"Downtown",42.35731,-71.06179,"Entire home/apt",79,91,259,"10/11/2020",3.74,1,350,"A1",12,0.611396103067893,0.467677669529664,"doc504",3,2,1,1,0,1,0,3,0,0,0,1,2,0,0,0,0,9706
"505",1327725,28837028,"3/30/2015",10943941,"Jim","The apartment was beautiful and clean upon arrival. Checkin instructions were easy and seamless. Having the dedicated parking spot was a very nice luxury as well. All essentials were supplied and easily accessible and local recommendations were spot on. I will definitely check here first on my next visit to Boston!","Modern 2 BR in Brighton with Parking",7205617,"Mikhail",NA,"Brighton",42.346,-71.1399,"Entire home/apt",98,3,273,"12/7/2020",2.95,1,41,"D14",51,0.347127301286885,0.600847099989802,"doc505",10,3,8,6,4,4,0,9,0,1,2,1,5,0,0,3,0,5828
"506",15018607,192512818,"9/10/2017",135539014,"Diane","Great location and friendly host.  Can't go wrong with Cloe's apartment!","Cute 1 bedroom in East Boston,  close to airport",94792025,"Cloe",NA,"East Boston",42.37033,-71.03767,"Entire home/apt",90,1,276,"12/18/2020",5.11,1,88,"A7",11,0.178778356574938,0.432601606111422,"doc506",2,1,1,1,1,0,0,3,0,2,0,1,2,0,0,1,0,3627
"507",13378923,342245605,"10/28/2018",178718577,"Karen","The location is ideal to travelers who want many things within walking distance.  Even though many sites are up to 2+ miles away, it is very walkable.  There are so many restaurants within a very short distance.  I would recommend not having a car as parking is not convenient or cheap.  The nearest garage was 1/2 mile away and $40/24 hour period.  Could save a bit by parking at off times at the school across the street but not always available.  Uber/Lyft is readily available.  Proximity to the airport is good, the neighborhood is lively and felt safe.  The bed and additional touches left by our hosts were great!  Pack a little lighter suitcase as there are stairs from street to the entry and a flight of stairs to the unit.","Montgomery Place - Studio (Room 6)",75997654,"Kathe",NA,"South End",42.34347,-71.07368,"Entire home/apt",100,29,159,"9/19/2020",2.85,3,80,"D4",129,0.403546552192692,0.205322681129241,"doc507",17,16,10,11,6,14,0,33,5,2,6,2,14,3,3,9,0,11261
"508",19138622,350555464,"11/19/2018",129176508,"Gregory","This one bedroom apartment was very much as advertised. Well appointed, heating and cooling and close to Mass Ave and Symphony T stops for getting around Boston. There was good information provided about shopping for groceries and pleasure. The description of the apartment was very accurate - two flights of stairs and traffic noise from a busy street but this was offset by having a great living space and separate bedroom rather than sterile hotel room. The host was very quick to respond to a couple of texts about how to operate things in the apartment. I thoroughly enjoyed my stay.","19th Century Rehab |City Views|So End 1BD 1BA #4",814298,"Thatch",NA,"Roxbury",42.33851,-71.08164,"Entire home/apt",280,30,61,"9/11/2019",1.36,90,41,"B2",100,0.283381955398458,0.25196687551316,"doc508",7,11,7,3,7,8,1,27,2,2,4,5,8,4,0,12,0,14525
"509",4105704,72239768,"5/1/2016",47510720,"Kelly","I booked Helen's studio apartment for my husband and his lifelong best friend for a guys' baseball weekend in Boston.  I wanted them to have a more ""local"" vibe to their stay, rather than a typical hotel experience.  They enjoyed their stay and mentioned that Helen and her family were kind and thoughtful.  They especially enjoyed the delicious goodies.  

My husband also mentioned there is a huge, 200+ acre wooded area just behind the home where he and his friend did some jogging/working out - great for you fitness buffs!

I was particularly pleased with the ease in booking the apt and Helen's responsiveness.  She was a pleasure to work with.  Highly recommend!","Sunny Private Studio Aptmt",21299112,"Helen",NA,"Jamaica Plain",42.30236,-71.11491,"Entire home/apt",125,29,256,"12/12/2020",3.3,1,0,"E13",112,0.353680621165149,0.537001857758329,"doc509",9,9,9,4,6,10,0,26,1,5,17,4,14,2,1,14,0,5214
"510",15821724,518922262,"8/27/2019",1779645,"Katherine","Peter was a gracious host who accommodated our early check-in with many considerate touches in the AirBnB. Highly recommend!","Upscale 2 Bdrm Suite: Kitchen, Spa Bathroom, WiFi",44448784,"Peter",NA,"Dorchester",42.28036,-71.0683,"Entire home/apt",82,14,117,"2/6/2021",3.53,1,148,"C11",20,0.158333333333333,0.524437529380023,"doc510",3,3,2,1,0,2,0,3,0,0,2,1,3,0,0,3,0,12501
"511",7239024,41256430,"8/5/2015",38953399,"Heather","Polly was great and met us when we arrived, which was a lot later than we had expected. The house was very nice and neat and we felt very welcomed. We had our dog with us too, so the fenced in back yard was an unexpected surprise.","M&R Quiet Back Room Parking Bathroom",7988017,"Polly Minter",NA,"Dorchester",42.29263,-71.05575,"Private room",52,2,199,"2/16/2021",2.91,3,358,"C11",47,0.556718436125112,0.422649948538445,"doc511",5,2,7,5,3,4,0,6,0,0,8,0,5,1,0,6,0,12501
"512",13829133,117356587,"12/6/2016",105269882,"Deion","The host canceled this reservation 38 days before arrival. This is an automated posting.","Sunny studio in JP!",45771009,"Riyo",NA,"Jamaica Plain",42.31798,-71.10875,"Entire home/apt",95,5,218,"12/28/2020",4.16,2,231,"E13",13,0,0,"doc512",1,1,0,1,0,3,0,5,1,0,1,0,2,0,0,1,0,5214
"513",25326962,723338804,"1/10/2021",72327762,"Gino","Great location. Clean place. 
MiMi is the best security system","Private parking(sedan size), clean, comfy room@3",183805757,"Claire",NA,"East Boston",42.36819,-71.03993,"Private room",53,1,185,"1/17/2021",5.54,3,35,"A7",10,0.163293914506847,0.362669207238372,"doc513",3,0,0,1,0,1,0,4,0,0,1,0,2,0,0,0,0,3627
"514",15313517,198507247,"9/29/2017",128139880,"Pauline","L'appartement est situé à 5minutes à pied de la ligne rouge du métro, et est totalement fidèle aux photos.
Communication simple et rapide avec Jorge.
Encore Merci à Justin et Jorge pour leur accueil et leur gentillesse.","Modern + Cool Spacious Studio Steps to the Subway",85533422,"Justin Henry & Jorge",NA,"Dorchester",42.31173,-71.0497,"Entire home/apt",140,91,104,"10/20/2019",1.95,2,20,"C11",36,0.104446593573419,0.088327058659981,"doc514",4,1,0,0,0,0,0,15,1,0,0,6,4,0,0,2,9,12501
"515",40971193,632266510,"6/26/2020",349091889,"Leonardo","Beautiful house in South Boston. I highly recommend this place. 10x better than what I expected.","Rare discount!! Luxurious home w/private roofdeck",205105042,"Thuy",NA,"South Boston",42.33484,-71.02684,"Entire home/apt",695,2,40,"2/7/2021",3.23,1,275,"C6",16,0.0415079966769199,0.35483368831534,"doc515",2,1,1,0,0,1,0,3,1,0,3,2,3,1,0,2,0,6984
"516",31429443,454542867,"5/18/2019",252876708,"Joshua","We are Boston locals but needed a place to stay while our home was being renovated. This was perfect for us - comfortable and clean, on a quiet tree-lined side street, and very accessible to parks, public transportation, and all that Jamaica Plain has to offer. Meg was a fantastic host, and if we ever needed anything, we knew she was available. We’d highly recommend!","Flat in the Jamaica Plain Hills",884747,"Meg",NA,"Jamaica Plain",42.31,-71.10084,"Entire home/apt",110,2,48,"1/24/2021",1.95,1,37,"E13",66,0.280878863760288,0.394782238245176,"doc516",8,3,3,6,5,5,0,9,0,2,9,4,12,2,0,10,0,5214
"517",17592876,285414916,"7/3/2018",198499809,"An","I like this location.","Transportation Accessible Home",119541425,"Esameldin",NA,"Dorchester",42.319,-71.06317,"Entire home/apt",160,29,127,"12/25/2020",2.66,1,357,"C11",4,NA,0.25,"doc517",0,0,0,0,0,1,0,1,0,0,1,0,1,0,0,1,0,12501
"518",22788158,494085661,"7/23/2019",148045275,"Deb","We thoroughly enjoyed our accommodations. Beautiful space and lovely space. Great hosts.","*Victorian Brownstone heart of the South End!",4882636,"Elena",NA,"South End",42.34218,-71.07716,"Entire home/apt",188,2,202,"1/3/2021",5.49,1,41,"D4",12,0.163008478796812,0.490529126447723,"doc518",3,0,1,0,1,0,0,4,0,0,2,0,3,0,0,1,0,11261
"519",21190750,534285797,"9/22/2019",260390388,"Michelle","Super cute place to stay, nice neighborhood and great continental breakfast options!  Very clean, wonderful place!  Loved exploring Boston!!!","Instaworthy Getaway Suite Private Entry/Bath 2Beds",52881930,"Bill And Maureen",NA,"South Boston",42.33451,-71.02731,"Entire home/apt",119,2,279,"12/6/2020",7.28,3,179,"C6",19,0.209647489303036,0.85999273778417,"doc519",6,0,2,0,1,0,0,5,0,1,0,1,5,0,0,3,0,6984
"520",23171291,285010614,"7/2/2018",110909069,"Allison","Firlian was a very accommodating and quickly responsive host. He insured my living arrangements were as advertised and assisted me with recommendations of local things to do and most economical ways to get there. The only downside was necessary construction to the house during the day (when I sleep), but Firlian offered accommodating alternatives. I would definitely stay at this location again if I was in the area. 
Thanks for everything, Firlian!","Comfortable queen bed, high ceiling Room.",67103816,"Firlian",NA,"Roxbury",42.31743,-71.09182,"Private room",37,31,9,"12/13/2020",0.28,8,356,"B2",72,0.434136675862757,0.35253389921172,"doc520",7,7,8,5,4,6,0,14,0,2,7,2,9,1,0,9,0,14525
"521",8442940,482449464,"7/6/2019",223058471,"Danielle","Great place at great location. Lots of nearby restaurants. Hosts were great","Sunny and cozy home near one end of freedom trail",3022224,"Krishna & Meena",NA,"Charlestown",42.37868,-71.06338,"Entire home/apt",139,2,245,"10/4/2020",3.73,1,59,"A15",12,0.226740592204508,0.259796837524698,"doc521",4,2,0,1,0,0,0,5,0,0,0,0,2,0,0,0,0,1913
"522",29161033,611600578,"2/27/2020",131215646,"Shantiera","Omg best accommodation ever! Our hosts went above and beyond to ensure we were comfortable in the space with many options of complimentary tea, coffee and beverages. It is SOOOO close to the T stop — which is the most convenient means of transportation EVER! You can get to Downtown Boston in under fifteen minutes and the neighborhood is very friendly. I recommend staying with Totana And Emma, as they were great host and made my trip to Boston smooth, and more enjoyable!!","Zakim Room-Walk to Subway&Logan airport",29684380,"Totana & Emma",NA,"East Boston",42.38224,-71.01996,"Private room",47,29,219,"2/2/2021",7.64,3,90,"A7",82,0.178201024828143,0.440499951033344,"doc522",9,10,9,6,6,4,0,14,1,1,8,7,9,1,0,6,0,3627
"523",21597670,541629129,"10/5/2019",68433235,"Carrie","This place is a wonderful choice for visiting Boston.  It is a very clean comfortable place with a wonderful family nearby to help if you need. The T station is not far away and Boston is easy to navigate.  Also parking is not difficult.  No tv, but you should spend most of your time enjoying this wonderful city and ready to rest when you get in.  Great value for your money.","Entire 1-bedroom Apartment Near Downtown/Longwood",60155656,"Jc & Cm",NA,"Roxbury",42.32029,-71.0937,"Private room",65,29,103,"3/28/2020",2.58,1,213,"B2",71,0.481899157608924,0.590660844161161,"doc523",10,3,7,6,3,7,0,11,0,5,6,3,7,2,0,8,0,14525
"524",6465075,92803733,"8/10/2016",40213672,"<U+6653>","Catlin is the most professional host I've ever met. She provides everything you need. The surrounding area has nothing fun, but it is very close to the metro station. One of the room on the top floor which is really hot at night, but other rooms are just perfect.","Spacious 5BR Condo Near Metro",635157,"Catlin",NA,"Jamaica Plain",42.29716,-71.1119,"Entire home/apt",400,29,113,"12/31/2020",1.62,1,355,"E13",49,0.30092428425375,0.352990355711403,"doc524",8,4,5,5,2,5,0,8,1,0,7,1,6,0,0,4,0,5214
"525",9685102,137973801,"3/18/2017",82736130,"Hafsa","Max's home was beautiful, affordable, and close to public transit. The size of Boston make's it necessary to use an uber to get downtown, but once you are downtown everything is within walking distance. We had no trouble checking in or out and the apartment was very clean with decent access to public parking.","Spacious room in two-room condo in Boston MA",815156,"Max",NA,"Brighton",42.33589,-71.14895,"Private room",51,91,197,"11/13/2019",3.17,1,364,"D14",54,0.325049090917682,0.390132542117832,"doc525",9,6,2,5,4,4,0,11,0,3,4,2,6,1,0,5,0,5828
"526",8634599,299764024,"7/31/2018",5277002,"Marianne","This Air BnB studio could be a dreamy pied-a-terre in Paris but – even better!  - it is in beautiful Jamaica Plain. Situated on the second floor in a gorgeous old JP mansion-house, steps from a beautiful park, around the corner from a busy shopping/restaurant district and a short walk to the Orange Line, this location could not be more perfect. This neighborhood is simply beautiful. Close to the Auboretum; close to Jamaica Pond. 

This unit is two very large, airy rooms combined into one, with a very comfortable (firm) poster queen bed, multiple dressers, an oversized couch, a settee and a formal dining table with four chairs. You’ll find a sink, microwave, refrigerator, coffee maker, hot plate and dishes, so you can prepare simple meals with ease. Lots of windows look out over the lovely neighborhood. A ceiling fan and an air conditioner keep it cool in hot weather. 

The bathroom is charming and spacious with a modern dual-headed shower. Believe it or not….there is a washer and dryer too. 

Jil, the host, is wonderful. She lives downstairs and is immediately responsive to any needs her guests have. A long-time resident of JP, she can give lots of tips about fun things to do in the area. 

I meant to stay a few weeks, but stayed two months. I can’t wait to go back. And, Jil has properties on the Cape….I’ll be heading here soon too.   : )
","Stunning suite, historic victorian",45402419,"Jil",NA,"Jamaica Plain",42.31063,-71.11184,"Private room",157,91,41,"10/29/2019",0.63,3,364,"E13",246,0.21185924433395,0.237451990440964,"doc526",27,24,15,16,11,32,0,63,4,6,12,11,50,0,0,25,0,5214
"527",4863108,211257205,"11/12/2017",21605883,"Rossana","Dan’s place is great. Very comfortable and close to fun tourist areas in Boston. Would definitely stay here again if I find myself back in Boston.","Ensuite Private Room in Boston",8157833,"John",NA,"South Boston",42.33775,-71.05145,"Private room",92,3,213,"1/3/2021",2.87,1,342,"C6",27,0.363845651448077,0.330132830486071,"doc527",4,3,5,2,1,0,0,3,0,1,2,3,3,1,0,2,0,6984
"528",6690605,49026886,"9/30/2015",26221962,"Ruediger","Very beautiful apartment in top condition in a charming house with all amenities (kitchen, washer and dryer etc.) Great location. Whole Foods is just a few minutes walk away. So is the harbor where you can catch a shuttle to Boston downtown. By bicycle it takes only about 10-15 minutes to MIT, mostly on bike paths. Very responsive and friendly host. I can highly recommend this place and I am glad I had an opportunity to stay there.","Renovated Boston Apartment",35018472,"Jennifer",NA,"Charlestown",42.37814,-71.06329,"Entire home/apt",200,91,24,"8/13/2019",0.36,1,0,"A15",77,0.553790615963323,0.662779065567569,"doc528",7,8,10,5,3,7,0,20,2,1,6,3,11,0,1,6,1,1913
"529",16841857,299248539,"7/30/2018",126331906,"Peter","We had a very relaxing and enjoyable stay. Steve is an excellent host and the apartment was exactly as described. Beds were very comfortable, and there were plenty of fresh towels. The kitchen is extra nice, and we were pleasantly surprised to find the fridge and cabinets stocked with everything we needed. The couch and all the other furniture was incredibly comfortable. We also loved the giant TV in the living room. Air conditioning units worked very well to keep the whole place cool despite some very hot, humid weather.","All the comforts of home, quiet city neighborhood",98067809,"Steve",NA,"Brighton",42.34947,-71.17213,"Entire home/apt",119,1,170,"1/31/2021",3.53,1,84,"D14",90,0.26453348206818,0.386366833317101,"doc529",15,4,10,6,6,12,0,18,0,2,6,1,10,0,0,10,0,5828
"530",26395595,296355059,"7/25/2018",203548435,"Josephine","Great place to stay! It was clean, nicely decorated and in an area with great restaurants. Would definitely stay there again!","Separate entrance in-law suite in heart of JP",145681148,"Marianne",NA,"Jamaica Plain",42.30668,-71.11793,"Entire home/apt",115,1,98,"12/30/2020",3.09,2,0,"E13",21,0.327615240177874,0.317564593210327,"doc530",3,2,4,2,1,1,0,3,0,1,1,0,4,0,0,3,0,5214
"531",24829523,486437348,"7/12/2019",6728063,"Faye","<U+623F><U+5B50><U+975E><U+5E38><U+6E29><U+99A8>,<U+79BB><U+534E><U+4EBA><U+8D85><U+5E02><U+5341><U+4E94><U+5206><U+949F><U+5185><U+7684><U+8F66><U+8DDD>,<U+793E><U+533A><U+975E><U+5E38><U+5B89><U+5168><U+FF61>","3 br/2 bath town house in Lower Mills, Boston",79660976,"Hillary",NA,"Mattapan",42.27085,-71.0711,"Entire home/apt",300,29,20,"9/1/2020",0.6,1,364,"B3",0,NA,0,"doc531",0,0,0,0,0,0,0,1,0,0,0,0,0,0,0,0,0,11007
"532",13864415,477106069,"6/27/2019",91541389,"Andres","Great location if you're going to an event at the convention center.","Comfy room (C) near T, convention center, downtown",19008767,"Ellen",NA,"South Boston",42.33893,-71.04987,"Private room",109,91,35,"7/31/2019",0.62,5,269,"C6",12,NA,0.331976404784035,"doc532",1,2,0,1,0,2,0,4,0,0,1,0,1,1,0,1,0,6984
"533",7965521,185450844,"8/21/2017",135423278,"Cristian","Great little place. Walking distance to a lot of local restaurants, shops and attractions. Exactly as pictured and described, no surprises.","South End 1 Bedroom PERFECTION!",22110106,"Chris",NA,"South End",42.34479,-71.07469,"Entire home/apt",225,91,171,"1/11/2020",2.61,1,364,"D4",21,0.125948321463866,0.105538689846828,"doc533",3,2,1,0,2,2,0,7,0,0,0,0,5,1,0,3,0,11261
"534",21769647,287856900,"7/8/2018",176053388,"Lisa","Really great, affordable accommodations and nice hostess! She was so sweet and welcoming but also gave me my space.","Comfy 1BR",158218784,"Angela",NA,"Dorchester",42.29339,-71.07548,"Private room",70,29,173,"2/7/2021",4.44,1,180,"C11",19,0.595034244285608,0.63754777525327,"doc534",5,0,3,1,3,0,0,3,0,0,3,0,3,0,0,1,0,12501
"535",7330494,102312433,"9/17/2016",65210790,"Erin","Katarzyna's place was a quiet, hidden gem in South Boston. It was only a few minutes walk to the T, which was so convenient.  The neighborhood was low key and so much better than staying downtown.  The garden is adorable and perfectly kept, so nice to spend time out there.  The place was extremely clean and everything we needed was there. She was very clear with communication, and responds very quickly to texts.  She was also very flexible with our needs. I would highly recommend staying here!!","Private apartment /parking/cozy garden. STR-398119",38403389,"Katarzyna",NA,"South Boston",42.33062,-71.05558,"Entire home/apt",95,3,288,"1/31/2021",4.24,1,351,"C6",87,0.20282729722658,0.418925411336659,"doc535",10,5,17,9,4,6,0,12,0,2,8,4,12,1,0,10,0,6984
"536",15147053,650569427,"8/13/2020",1473565,"Hannah","We stayed at Lynel's place for 4 nights and had a wonderful and comfortable stay. Since we were moving out of the country with our dog, we had a couple of extra questions and needs and Lynel was always super responsive and helpful. The place was very clean and cool during some hot summer Boston days, and it had everything you need in an Airbnb.","Historic JP Brownstone with Parking. Pets Welcome!",14630158,"Lynel",NA,"Jamaica Plain",42.30849,-71.10801,"Entire home/apt",82,29,251,"1/31/2021",4.79,1,65,"E13",64,0.103041570550602,0.452407078066334,"doc536",8,8,3,3,7,6,0,12,1,1,7,3,5,1,0,6,0,5214
"537",18342681,157115434,"6/2/2017",131913829,"Ling","The location of the house is great, just 10 mins walk to the airport shuttle. During the daytime, you could hear the jet every 3 minutes, but when you are sleeping there is almost no airplane. The room was clean and tidy, simple IKEA style which is my favorite. And the bathroom is also super clean. When you open the fridge, you would say ""wow"", it's full of all kinds of drinks. Even I didn't meet the hosts, I could feel their friendly and welcome. I would definitely stay there again if I have a chance.","<U+2605> Modern, Cozy & Convenient <U+2605> Close to Downtown!",69587,"Boris & Susan",NA,"East Boston",42.37488,-71.03589,"Private room",43,1,409,"1/30/2021",8.83,8,180,"A7",94,0.251597945664698,0.275965304665862,"doc537",8,5,10,11,4,13,1,19,2,1,13,0,16,1,0,10,0,3627
"538",798957,154416922,"5/24/2017",34682189,"Eloy","Edward's Place was everything we expected and more. Clean, fully stocked, centrally located, In a beautiful and safe neighborhood. 
The ""more"" was Edwards attention to detail and his availability. 
We highly recommend this property, and will certainly consider it for future visits to Boston","<U+2605>Discounted<U+2605> NearHospitals<U+2605>2floors<U+2605> 2 Baths,2beds",1651480,"Edward",NA,"South End",42.34232,-71.07594,"Entire home/apt",261,28,418,"8/1/2020",4.4,4,0,"D4",44,0.350368404417884,0.306241313612113,"doc538",6,4,5,3,4,3,0,7,0,1,5,3,9,0,0,4,0,11261
"539",3749523,261555283,"5/6/2018",56123954,"Margaret (Meg)","Lovely historic place & excellent location.","Grand Colonial in Historic Boston.",3842205,"Nicolo",NA,"Charlestown",42.37191,-71.06333,"Entire home/apt",125,32,276,"11/25/2020",3.46,1,268,"A15",5,NA,0.96150923032491,"doc539",2,0,1,0,1,0,0,2,0,0,0,0,1,0,0,0,0,1913
"540",1881298,426576890,"3/21/2019",111451325,"Julissa","This place was fantastic! The apartment itself was much larger than I anticipated. It was super clean and chic. Comfy beds, tons of linens and towels, and anything you'd need for your stay. The proximity to the T was so great. We walked about two minutes and there we were. It's also right by a few great restaurants. Being able to park in the driveway and then go out and enjoy Boston without parkung worries was perfect. We will definitely stay here again!","Private Apartment- Minutes from T!",1920539,"Caitlin & Dan",NA,"Jamaica Plain",42.30026,-71.11181,"Entire home/apt",117,1,538,"12/12/2020",6.07,1,310,"E13",83,0.258428204034834,0.304169372613906,"doc540",11,6,11,10,6,6,0,13,1,1,10,2,11,1,0,7,0,5214
